"ID","Title","Series","Text","Date1","Date2","Appt Pres","Case1","Case2","Case3","Citation"
1425,"Douglas H. Ginsburg","People","D.C. Circuit Judge Douglas Ginsburg was President Reagan's second failed nomination to succeed Justice Lewis Powell. Questions about financial improprieties and also marijuana use while a professor at Harvard led to the withdrawal of the nomination.","1986","2011","Reagan",,,,,
1426,"Ebenezer R. Hoar","People","Ebenezer Hoar was the 30th U.S. Attorney General, appointed by President Grant. Hoar also represented Massachusetts in Congress, and served as a state court judge. Grant nominated Hoar to the Supreme Court, but Hoar's resistance to party politics played a role in the Senate's failure to confirm, by vote of 33-24.","1869","1870","Grant",,,,,
1427,"Edward A. Bradford","People","Edward A. Bradford was a New Orleans attorney nominated by President Fillmore to the Supreme Court upon the death of Justice John McKinley. Fillmore, the last Whig president, could not get the Democratic Senate to bring the nomination to a vote, and subsequently failed with his next two nominees as well.","1814","1872","Fillmore",,,,,
1428,"Edward King","People","A lawyer and judge on the Philadelphia Court of Common Pleas, Edward King was twice nominated to the Supreme Court by President John Tyler. Due to a lack of support for Tyler in the Senate, however, the Senate failed to act on either nomination.","1794","1873","Tyler",,,,,
1429,"G. Harrold Carswell","People","Named to the Northern District of Florida by President Eisenhower, and the 5th Circuit by Nixon, G. Harrold Carswell was then Nixon's second nominee to replace Justice Fortas on the Supreme Court. The nomination failed, 51-45, due in part to Carswell's record on race.","1969","1970","Nixon",,,,,
1430,"George Edmund Badger","People","The 12th Secretary of the Navy under William Henry Harrison & John Tyler, Badger was a North Carolina Senator when Millard Fillmore nominated him for Associate Justice following the failed nomination of Edward Bradford. His nomination failed 26-25; he later voted for North Carolina's secession from the Union.","1841","1841","W.H. Harrison",,,,,
1431,"George Henry Williams","People","George Henry Williams was serving as the 32nd Attorney General when Ulysses Grant nominated him for Chief Justice; with opposition in the Senate, the nomination was withdrawn. Previously, Williams had served as Chief Justice of the Oregon Territory and Senator; in later years he was mayor of Portland.","1871","1875","Grant",,,,,
1432,"George W. Woodward","People","Nominated by James K. Polk to fill the vacancy of Justice Henry Baldwin, Woodward, a Pennsylvania state judge, was not confirmed in the Senate, by vote of 20-29. He later went on to serve on the Pennsylvania Supreme Court, including as Chief Justice, and as a Congressman.","1867","1871","Polk",,,,,
1433,"Harriet Miers","People","A longtime lawyer, Harriet Miers served the George W. Bush administration as Deputy Chief of Staff and as the 31st White House Counsel. While in the latter role, she was nominated to replace Justice Sandra O'Connor on the Supreme Court. A lack of Senate support, however, led to the withdrawal of the nomination.","2005","2007","G.W. Bush",,,,,
1434,"Henry Stanbery","People","The 1st Ohio Attorney General, and 28th U.S. Attorney General under Andrew Johnson, Henry Stanbery was nominated by Johnson to the Supreme Court. The Anti-Johnson Senate not only failed to act on the nomination, but reduced the number of seats on the Court. Stanbery represented Johnson during his impeachment.","1866","1868","A. Johnson",,,,,
1435,"Jeremiah S. Black","People","A Chief Justice of the Pennsylvania Supreme Court, Black became the 24th Attorney General under President Buchanan (and also the 23rd Secretary of State). Buchanan nominated Black to the Supreme Court, but he was rejected by the Senate. He then briefly served as the Court's 6th Reporter of Decisions.","1860","1861","Buchanan",,,,,
1436,"John C. Spencer","People","A state legislator and Congressman, John C. Spencer served as both the 17th Secretary of War and the 16th Secretary of the Treasury under President John Tyler. Tyler also nominated Spencer to a seat on the Supreme Court, but Tyler's unpopularity in the Senate led to a 21-26 defeat for Spencer.","1843","1844","Tyler",,,,,
1437,"John J. Parker","People","A North Carolinian serving on the Fourth Circuit (appointed by Coolidge), John J. Parkerย was nominated to the Supreme Court by President Hoover. Opposition by groups including the NAACP and the American Federation of Labor led to a 39-41 rejection in the Senate. Parker continued a long career on the 4th Circuit.","1925","1958","Coolidge",,,,,
1438,"John Jordan Crittenden","People","John J. Crittenden served Kentucky as a Congressman, as a Senator (4 times), and as its 17th Governor. He was twice Attorney General, first under William Henry Harrison and John Tyler, and again under Fillmore. He was nominated to the Supreme Court by John Quincy Adams, but the Senate failed to act on his nomination.","1850","1853","Fillmore",,,,,
1439,"John Meredith Read","People","Both of John Read's grandfathers served in the Continental Congress. After serving as a U.S. Attorney, Read was appointed to the Supreme Court by John Tyler, whose unpopularity in the Senate caused the nomination to founder. Read later sat on the Pennsylvania Supreme Court.","1858","1872","Tyler",,,,,
1440,"Reuben Hyde Walworth","People","A congressman and the last Chancellor of New York, Reuben Hyde Walworth was yet another of President John Tyler's failed Supreme Court nominees. With few allies in the Senate, Tyler withdrew Walworth's nomination in favor of John C. Spencer's, only to re-nominate Walworth when Spencer's nomination also failed.","1823","1825","Tyler",,,,,
1441,"Robert H. Harrison","People","A Revolutionary War lieutenant colonel and Chief Justice of the Maryland General Court, Robert H. Harrison was nominated to the Supreme Court by George Washington. Although confirmed by the Senate, Harrison was in poor health and declined. He received 6 electoral votes in the first presidential election.","1781","1790","Washington",,,,,
1442,"Roscoe Conkling","People","A New York congressman and senator, Conkling declined an offer of the Chief Justiceship from President Grant.ย Later he was nominated to the Court by President Arthur, confirmed by the Senate, and then declined the position, the last person to be confirmed and to decline.","1867","1881",,,,,,
1443,"Wheeler Hazard Peckham","People","The brother of Supreme Court Justice Rufus W. Peckham, President Cleveland nominated Wheeler to the Court prior to nominating his brother. Wheeler had invoked the wrath of fellow New Yorker, Senator David Hill. Hill prevailed and Wheeler's nomination was defeated.","1833","1905","Cleveland",,,,,
1444,"William B. Hornblower","People","One of two of President Grover Cleveland's Supreme Court nominees to be derailed by New York Senator David B. Hill, William Hornblower was to be considered a second time by Cleveland, but declined. He eventually gained a seat on the New York City Court of Appeals, but resigned almost immediately due to poor health.","1914","1914","Cleveland",,,,,
1445,"William Chatfield Micou","People","A New Orleans attorney, William C. Micou was the third attempt by President Fillmore to fill Justice McKinley's seat on the Supreme Court (4th, if one counts declined offers). The Dem Senate rejected the Whig nominee. The seat was filled shortly thereafter when Franklin Pierce became president.","1806","1854","Fillmore",,,,,
1446,"William Homer Thornberry","People","An 8-term congressman, LBJ appointed William Thornberry to both the district court and 5th Circuit. When LBJ nominated Abe Fortas to Chief Justice, he nominated Thornberry to Fortas's associate justice position. When the Fortas nomination crumbled, so did Thornberry's. He was the last nominee to serve in Congress.","1965","1978","L.B. Johnson",,,,,
1447,"A. Leon Higginbotham, Jr.","People","Leon Higginbotham was a federal judge, first with the Eastern District of Pennsylvania and later the 3rd Circuit, including a stint as Chief Judge. He was the first black judge on the 3rd Circuit.ย In 1995, he was awarded the Presidential Medal of Freedom. He was appointed to the appellate court by Carter.","1977","1993","Carter",,,,,
1448,"Abner J. Mikva","People","Judge Mikva is one of the few people to serve in all 3 branches of the federal government, serving as a Congressman from Illinois, a judge of the U.S. Court of Appeals for the D.C. Circuit, and White House counsel under President Clinton.","1979","1994","Carter",,,,,
1449,"Alex Kozinski","People","Judge Alex Kozinski was appointed to the Ninth Circuit Court of Appeals by President Reagan at the age of 35, making him the youngest federal appellate judge at the time of appointment.ย Out of law school, he clerked for then-Judge Anthony Kennedy on the 9th Circuit and for Chief Justice Burger.","1985","present","Reagan",,,,,
1450,"Alfred P. Murrah","People","Alfred P. Murrah was a U.S. District Court and, later, 10th Circuit judge, appointed to both courts by President Franklin D. Roosevelt. As a trial judge, he was notable for his early adoption of pretrial conferences. The federal building destroyed in the Oklahoma City bombing was named for him.","1940","1970","F.D. Roosevelt",,,,,
1451,"Arthur T. Vanderbilt","People","A former president of the ABA, Vanderbilt became the first Chief Justice of New Jersey following adoption of a new state constitution that modified the state's judiciary. As New Jersey's Chief Justice, he was a mentor to then fellow NJ Supreme Court Justice William Brennan.","1948","1957",,,,,,
1452,"Augustus Noble Hand","People","The first cousin of Learned Hand, Augustus also served on both the Southern District of New York and Second Circuit courts, sometimes overlapping service time with his cousin.ย He has the distinction of having been appointed to the district court by a Democrat (Wilson) and to the circuit court by a Republican (Coolidge).","1928","1954","Coolidge",,,,,
1453,"David L. Bazelon","People","Appointed by President Truman to the D.C. Circuit Court at the age of 40, Bazelon, who served as Chief Judge for 16 years, was the youngest person ever appointed to that court. His career was notable for his championing of the rights of those suffering from mental diseases and defects.","1949","1979","Truman",,,,,
1454,"Frank H. Easterbrook","People","One of the most cited appellate judges, Frank Easterbrook was appointed to the U.S. Court of Appeals for the Seventh Circuit by President Reagan, and served a 7-year stint as chief judge of that court. He worked as a Deputy Solicitor General under SG Robert Bork.","1985","present","Reagan",,,,,
1455,"Griffin Bell","People","A judge of the 5th Circuit for 14 years, appointed by President Kennedy, Bell later served as the 72ndย Attorney General of the United States during the Carter Administration.ย Despite his Democratic credentials, he also served the Reagan and George H. W. Bush Administrations in various roles.","1977","1979","Carter",,,,,
1456,"Henry J. Friendly","People","One of the most distinguished circuit judges of all time, Henry J. Friendly was appointed to the Second Circuit by President Eisenhower. Among his many law clerks to achieve legal fame is Chief Justice John Roberts. He is rumored to have attained the highest GPA at Harvard Law School.","1959","1974","Eisenhower",,,,,
1457,"J. Harvie Wilkinson III","People","A noted conservative jurist, J. Harvie Wilkinson, III was appointed to the 4th Circuit Court of Appeals by President Reagan. Wilkinson served as fellow Virginian Justice Lewis Powell's first clerk upon Powell's nomination to the Supreme Court. He had frequently been mentioned as a possible nominee for the Court himself.","1984","present","Reagan",,,,,
1458,"James Kent","People","A New York Jurist, eventually Chancellor of the New York Chancery Court, James Kent was a noted legal scholar and could properly be called the father of American equity jurisprudence. His Commentaries on American Law are a widely cited and important work on the development of early American law.","1814","1823",,,,,,
1459,"James Skelly Wright","People","As a Truman appointee on the U.S. District Court in New Orleans, J. Skelly Wright was the first U.S. district judge in the Deep South after Brown v. Bd. of Ed. to order a school to desegregate. He later served on the D.C. Circuit, appointed by John F. Kennedy, including 3 years as chief judge of that court.","1962","1986","Kennedy",,,,,
1460,"Jerome N. Frank","People","Appointed by President Franklin Roosevelt to the Second Circuit, Jerome N. Frank had previously succeeded Justice William Douglas as Chairman of the Securities & Exchange Commission. Among his cases on the Second Circuit was the opinion affirming the convictions of Julius and Ethel Rosenberg.","1941","1957","F.D. Roosevelt",,,,,
1461,"John J. Sirica","People","Appointed to the U.S. District Court for the District of Columbia by President Eisenhower, Judge John Sirica was chief judge of the court at the time that he presided over the trial surrounding the Watergate break-in. Ruling against Nixon's claim of executive privilege, his ruling was ultimately upheld by the Supreme Court.","1957","1977","Eisenhower",,,,,
1462,"John Minor Wisdom","People","Nominated by Eisenhower, John Minor Wisdom was one of the ""5th Circuit Four,"" a group of four liberal 5th Circuit judges who helped advance the civil rights of African Americans in the Deep South. He was awarded the Presidential Medal of Freedom.","1957","1977","Eisenhower",,,,,
1463,"Kenesaw Mountain Landis","People","Named for the Civil War battle in which his father was wounded, Kenesaw Mountain Landis was a U.S. District Judge in Chicago, appointed by Teddy Roosevelt.ย Following the Black Sox scandal, Landis became the 1st Commissioner of Baseball and banned the ""eight men out"" for life.","1905","1922","T. Roosevelt",,,,,
1464,"Learned Hand","People","Although he twice came close to appointment to the Supreme Court, Learned Hand goes down as one of the best known non-Supreme Court jurists in American history. Appointed to the district court by Taft and the Second Circuit by Coolidge, Hand spent over 50 years on the bench.","1924","1951","Coolidge",,,,,
1465,"Lemuel Shaw","People","One of the most-renown state court jurists in U.S. history, Justice Shaw served 30 years as Chief Justice of Massachusetts, authoring many common law opinions that still stand today, including the theory of negligence as the basis of tort law. His daughter married author Herman Melville.","1830","1860",,,,,,
1466,"Richard A. Posner","People","A leader of the ""law and economics"" movement, prolific author, and by some accounts the most-cited legal scholar of the 20th century, Judge Richard Posner was nominated to the Seventh Circuit Court of Appeals by President Ronald Reagan. He was often mentioned in the past as a potential Supreme Court nominee.","1981","present","Reagan",,,,,
1467,"Roger J. Traynor","People","The 23rd Chief Justice of California, Roger Traynor was one of the most respected state court judges of all-time. His opinions regularly find their way into law school casebooks; his New York Times obituary read ""Traynor was often called one of the greatest judicial talents never to sit on the United States Supreme Court.""","1940","1970",,,,,,
1468,"Roy Bean","People","Known as a ""hangin' judge"" in Western films (he only sentenced two men to hang), Judge Roy Bean was a saloon keeper and justice of the peace who held court in his Val Verde County, Texas saloon.ย He gave himself his nickname: ""The Law West of the Pecos.""","1882","1896",,,,,,
1469,"Shirley S. Abrahamson","People","The longest-serving justice in the history of the Wisconsin Supreme Court, Justice Shirley Abrahamson has served as Chief Justice of Wisconsin for almost 20 years. At the time that President Bill Clinton nominated Ruth Bader Ginsburg to the Supreme Court, Abrahamson had been under consideration.","1976","present",,,,,,
1470,"Spencer Roane","People","One of the early Republic's most important state judges, Spencer Roane sat on Virginia's highest court for almost 30 years. A slaveholder, he wrote many anonymous editorials against Marshall Court opinions that he feared would chip away at states' rights.","1795","1822",,,,,,
1471,"St. George Tucker","People","Best known for writing an influential American edition of William Blackstone's Commentaries, St. George Tucker also served on the Virginia Supreme Court. James Madison nominated Tucker to the Eastern District of Virginia court, and he often rode circuit with Chief Justice John Marshall.","1813","1825","Madison",,,,,
1472,"Thomas M. Cooley","People","A justice of the Michigan Supreme Court and a significant scholar and treatise-writer, Thomas M. Cooley's work Constitutional Limitations is one of the most important pre-20th century American legal works. Cooley served as the first chairman of the first powerful federal agency, the Interstate Commerce Commission.","1824","1898",,,,,,
1473,"William Henry Hastie","People","The first African-American federal judge, President Harry Truman nominated William H. Hastie to the 3rd Circuit (he had previously served as the first African-American governor of the U.S. Virgin Islands). President Kennedy considered Hastie for the Supreme Court seat that went to Byron White.","1949","1971","Truman",,,,,
1474,"Aaron Burr","People","Lawyer and statesman, Burr served as Vice-President and as such, presided over the impeachment trial of Justice Samuel Chase. He was later tried for treason, with Chief Justice Marshall, riding circuit, presiding over his trial, in which he was acquitted. Fatally wounded Alexander Hamilton in a duel.","1801","1805",,,,,,
1475,"Abraham Lincoln","People","A highly-regarded trial lawyer in Illinois, Lincoln became first a congressman, then President, leading the Union through the Civil War. Among his most notable accomplishments was the Emancipation Proclamtion, which freed the slaves in the states under rebellion.","1861","1865",,,,,,
1476,"Alexander Hamilton","People","A Founding Father and the first Secretary of the Treasury under President Washington, Hamilton was one of the three authors of The Federalist, arguing for the ratification of the U.S. Constitution by the states. Born on the Caribbean island of Nevis, Hamilton was mortally wounded in a duel with Aaron Burr.","1789","1795",,,,,,
1477,"Charles Hamilton Houston","People","Houston was the first African-American member of the Harvard Law Review and later, at Howard, taught Thurgood Marshall. He left his deanship at Howard to become counsel for the NAACP, leading the first wave of litigation against segregative laws.","1895","1950",,,,,,
1478,"Daniel Webster","People","Webster was one of the most notable lawyers of his time, and argued 249 cases before the Supreme Court,ย including Gibbons v. Ogden. He served as Secretary of State twice (the second time under President Fillmore), U.S. senator twice, and congressman twice (from two different states).","1850","1852","Fillmore",,,,,
1479,"Elias Boudinot","People","A member of the Continental Congress, including a term as its president, Elias Boudinot was an important early lawyer in the U.S. He served three terms as a New Jersey congressman and ten years as the director of the U.S. Mint. Boudinot was the first lawyer to become a member of the Supreme Court bar.","1789","1795",,,,,,
1480,"Ernest Knaebel","People","A longtime federal government lawyer, Ernest Knaebel eventually served as both a special assistant to the Attorney General and as Assistant Attorney General, under both Taft and Wilson. During his tenure as Reporter of Decisions of the Supreme Court, the U.S. Reports moved from private to public publishing.","1915","1944",,,,,,
1481,"George Wharton Pepper","People","A well-known lawyer and law professor, George Wharton Pepper also served an appointed term as a Senator from Pennsylvania. As a practicing lawyer in the Supreme Court bar, he was appointed by the Court to represent Congress in Myers v. United States.","1922","1927",,,,,,
1482,"Jack Greenberg","People","Joining the NAACP Legal Defense & Educational Fund in 1949, Jack Greenberg became its director in 1961 following the nomination of Thurgood Marshall to the 2nd Circuit Court of Appeals.ย He argued 40 cases in the Supreme Court, and helped to found Human Rights Watch.","1924","present",,,,,,
1483,"James M. Nabrit, Jr.","People","A famous civil rights lawyer who got his start challenging the white primary in Texas, James Nabrit moved to Washington, where he worked on challenging restrictive covenants and school segreagation. He eventually became dean of Howard Law School. He won 9 of 12 cases he argued in the Supreme Court.","1932","2013",,,,,,
1484,"James St. Clair","People","A prominent lawyer, James St. Clair worked with Army counsel Joseph Welch during the Army-McCarthy hearings. Most notably, St. Clair argued on behalf of President Nixon before the Supreme Court in U.S. v. Nixon, though he lost the argument that executive privilege prevented the disclosure of the Watergate tapes.","1920","2001",,,,,,
1485,"John Quincy Adams","People","A congressman, senator, ambassador, the 8th Secretary of State under James Monroe, John Quincy Adams was also the 6th President of the United States. A noted lawyer and leading abolitionist, he argued the Amistad case before the Supreme Court.","1825","1829",,,,,,
1486,"Joseph Hodges Choate","People","A lawyer and ambassador to the United Kingdom, Joseph Hodges Choate found early success. He argued many important cases before the Supreme Court, including Mugler v. Kansas, the Chinese Exclusion Cases (both losses), and Pollock v. Farmers' Loan & Trust Co. (winning in striking down the income tax).","1832","1917",,,,,,
1487,"Luther Martin","People","A Founding Father, Luther Martin represented Maryland at the Constitutional Convention, but did not sign the final document. A skilled lawyer, he practiced before the Supreme Court, as well as successfully defending Justice Samuel Chase against impeachment and Aaron Burr against treason.","1740","1826",,,,,,
1488,"Morris Leopold Ernst","People","Born in Alabama, but a lawyer in New York, Morris Leopold Ernst was a longtime general counsel for the ACLU. As a practitioner, he successfully defended James Joyce's Ulysses against obscenity laws, and won the striking down of Connecticut's restrictive birth control laws in Griswold v. Connecticut.","1888","1976",,,,,,
1489,"Walter Heilprin Pollak","People","One of the authors of the incorporation theory of the Bill of Rights, Walter Pollak, through artful Supreme Court advocacy in cases defending Communists (such as Whitney) and African-Americans (such as Powell v. Alabama) helped usher in the era of application of the Bill of Rights to the states via the 14th Amendment.","1887","1940",,,,,,
1490,"Zechariah Chafee, Jr.","People","One of the most important non-jurists with respect to the expansion of the right of free speech, Zechariah Chafee's arguments perhaps shifted Justice Oliver Wendell Holmes's views on the scope of the First Amendment and contributed to the ""marketplace of ideas"" conception of free speech rights.","1885","1957",,,,,,
1491,"Franklin Delano Roosevelt","People","Four-term President Franklin D. Roosevelt nominated some of the most brilliant members of the Supreme Court: Hugo Black; Felix Frankfurter; William O. Douglas; Harlan Fiske Stone; Robert H. Jackson; Wiley Rutledge. All that and World War II.","1933","1945",,,,,,
1492,"Alexander Bickel","People","One of the most influential legal scholars of the 20th Century, Bickel clerked for Justice Felix Frankfurter before becoming a constitutional scholar at Yale Law School. His most influential book, The Least Dangerous Branch, was named for a phrase used by Alexander Hamilton to describe the judiciary.","1924","1974",,,,,,
1493,"Charles Austin Beard","People","A significant constitutional scholar and historian, Beard taught at Columbia and was a significant proponent of the view that the Framers intended the judiciary to have the power of judicial review. His most significant work was An Economic Interpretation of the Constitution.","1874","1948",,,,,,
1494,"Charles Warren","People","One of the preeminent constitutional scholars, Warren is perhaps best known for his epic The Supreme Court in the History of the United States, which won the Pulitzer Prize for history. Though politically opposite the progressive Charles Beard, Warren agreed that judicial review was intended by the Framers.","1868","1954",,,,,,
1495,"Edward Samuel Corwin","People","A political scientist and constitutional scholar, Corwin's most well-known book was The Constitution and What It Means Today, which has continued to be updated after his death. Corwin was a frequent critic of the Court during the early years of the New Deal, when the Court struck down many pieces of legislation.","1878","1963",,,,,,
1496,"Ernst Freund","People","A prominent legal scholar of the 20th Century, Ernst Freund has been called ""the father of American administrative law.""ย His book Police Power: Public Policy and Constitutional Rights, was influential and cited by the Supreme Court in interpreting the Fourteenth Amendment.","1864","1932",,,,,,
1497,"James Bradley Thayer","People","A constitutional scholar of the 19th Century and a professor at Harvard Law School, James Bradley Thayer was one of the founders of the ""case method"" style of legal education, and authored one of the first articles calling into question the doctrine of judicial review.","1831","1902",,,,,,
